{
  "id": "seed-gen-005",
  "schema_version": 1,
  "kind": "generate",
  "input": {
    "description": "Задание на первообразную: функция выбирается случайно из небольшого набора (sin x, cos x, e^x, x²). В условии показываем выбранную функцию, ответ обязан вычисляться по ней, а не быть заранее написанным текстом."
  },
  "target_graph": {
    "version": 1,
    "nodes": [
      {
        "id": "f",
        "type": "random_choice",
        "params": {
          "elem_type": "expr",
          "items": [
            "sin(x)",
            "cos(x)",
            "exp(x)",
            "x**2"
          ]
        }
      },
      {
        "id": "i",
        "type": "integrate"
      },
      {
        "id": "cond",
        "type": "text",
        "params": {
          "text": "Найдите первообразную функции f(x) = #f#."
        }
      },
      {
        "id": "ansb",
        "type": "expr_block",
        "params": {
          "prefix": "F(x)"
        }
      },
      {
        "id": "task",
        "type": "static_task"
      }
    ],
    "edges": [
      {
        "from": "f:out",
        "to": "i:in"
      },
      {
        "from": "f:out",
        "to": "cond:f"
      },
      {
        "from": "i:out",
        "to": "ansb:in"
      },
      {
        "from": "cond:out",
        "to": "task:statement"
      },
      {
        "from": "ansb:out",
        "to": "task:answer"
      }
    ],
    "meta": {}
  },
  "provenance": {
    "source": "fable",
    "created_at": "2026-07-05T00:00:00Z",
    "catalog_version": "165616006ce6e373",
    "engine_commit": "34f1799",
    "validator": {
      "passed": true,
      "seeds": [
        0,
        1,
        2
      ]
    }
  },
  "tags": [
    "symbolic",
    "choice-pool",
    "vtuz"
  ]
}
