{
  "id": "seed-gen-002",
  "schema_version": 1,
  "kind": "generate",
  "input": {
    "description": "Сделай задания на неопределённый интеграл: случайный многочлен второй степени, в ответе — первообразная."
  },
  "target_graph": {
    "version": 1,
    "nodes": [
      {
        "id": "p",
        "type": "random_polynomial",
        "params": {
          "var": "x",
          "degree": 2
        }
      },
      {
        "id": "i",
        "type": "integrate"
      },
      {
        "id": "t",
        "type": "text",
        "params": {
          "text": "Найдите неопределённый интеграл от функции:"
        }
      },
      {
        "id": "fb",
        "type": "expr_block",
        "params": {
          "prefix": "f(x)"
        }
      },
      {
        "id": "bl",
        "type": "block_list",
        "params": {
          "count": 2
        }
      },
      {
        "id": "ansb",
        "type": "expr_block",
        "params": {
          "prefix": "F(x)"
        }
      },
      {
        "id": "task",
        "type": "static_task"
      }
    ],
    "edges": [
      {
        "from": "p:out",
        "to": "i:in"
      },
      {
        "from": "p:out",
        "to": "fb:in"
      },
      {
        "from": "t:out",
        "to": "bl:in0"
      },
      {
        "from": "fb:out",
        "to": "bl:in1"
      },
      {
        "from": "i:out",
        "to": "ansb:in"
      },
      {
        "from": "bl:out",
        "to": "task:statement"
      },
      {
        "from": "ansb:out",
        "to": "task:answer"
      }
    ],
    "meta": {}
  },
  "provenance": {
    "source": "fable",
    "created_at": "2026-07-05T00:00:00Z",
    "catalog_version": "165616006ce6e373",
    "engine_commit": "34f1799",
    "validator": {
      "passed": true,
      "seeds": [
        0,
        1,
        2
      ]
    }
  },
  "tags": [
    "symbolic",
    "plain",
    "vtuz"
  ]
}
